{
  "schema_version": "1.0",
  "run_id": "extract-kimsuky_001-deepseek-v4-flash-1.0-1.0-20260715164357825581-35971692",
  "doc_id": "kimsuky_001",
  "model_name": "deepseek-v4-flash",
  "prompt_version": "1.0",
  "generated_at": "2026-07-15T16:43:57.825581+00:00",
  "chunks": [
    {
      "chunk_id": "kimsuky_001_c001",
      "entities": [
        {
          "name": "Kimsuky",
          "type": "APT_GROUP",
          "aliases": [],
          "description": "APT组织，与KONNI存在关联",
          "mention_text": "Kimsuky",
          "evidence_text": "与APT组织Kimsuky存在关联",
          "char_start": 67,
          "char_end": 84,
          "confidence": 0.9,
          "candidate_status": "candidate",
          "validation_status": "valid",
          "validation_errors": []
        },
        {
          "name": "奇安信威胁情报中心红雨滴团队",
          "type": "ORGANIZATION",
          "aliases": [
            "红雨滴团队"
          ],
          "description": "奇安信威胁情报中心下属团队",
          "mention_text": "奇安信威胁情报中心红雨滴团队",
          "evidence_text": "奇安信威胁情报中心红雨滴团队在日常的高级威胁监测过程中",
          "char_start": 92,
          "char_end": 119,
          "confidence": 0.9,
          "candidate_status": "candidate",
          "validation_status": "valid",
          "validation_errors": []
        },
        {
          "name": "KakaoTalk",
          "type": "TOOL",
          "aliases": [
            "KaokaoTalk"
          ],
          "description": "韩国常用聊天软件，被伪装成木马",
          "mention_text": "KakaoTalk",
          "evidence_text": "木马程序运行后会窃取上传用户手机的一些机密信息",
          "char_start": 1033,
          "char_end": 1056,
          "confidence": 0.9,
          "candidate_status": "candidate",
          "validation_status": "valid",
          "validation_errors": []
        },
        {
          "name": "Android",
          "type": "TECHNIQUE",
          "aliases": [],
          "description": "移动操作系统，攻击目标平台",
          "mention_text": "Android",
          "evidence_text": "针对韩国地区Android用户的恶意代码攻击活动",
          "char_start": 126,
          "char_end": 150,
          "confidence": 0.9,
          "candidate_status": "candidate",
          "validation_status": "valid",
          "validation_errors": []
        },
        {
          "name": "韩国",
          "type": "COUNTRY",
          "aliases": [],
          "description": "攻击目标国家",
          "mention_text": "韩国",
          "evidence_text": "针对韩国地区Android用户的恶意代码攻击活动",
          "char_start": 126,
          "char_end": 150,
          "confidence": 0.9,
          "candidate_status": "candidate",
          "validation_status": "valid",
          "validation_errors": []
        },
        {
          "name": "2.56.151.8",
          "type": "INFRASTRUCTURE",
          "aliases": [],
          "description": "攻击者C2服务器IP地址",
          "mention_text": "2.56.151.8",
          "evidence_text": "攻击者C2：2.56.151.8地址",
          "char_start": 2834,
          "char_end": 2852,
          "confidence": 0.9,
          "candidate_status": "candidate",
          "validation_status": "valid",
          "validation_errors": []
        },
        {
          "name": "日本",
          "type": "COUNTRY",
          "aliases": [],
          "description": "跳板IP所在国家",
          "mention_text": "日本",
          "evidence_text": "控制该电脑的IP地址为一个日本的IP地址",
          "char_start": 2906,
          "char_end": 2926,
          "confidence": 0.9,
          "candidate_status": "candidate",
          "validation_status": "valid",
          "validation_errors": []
        },
        {
          "name": "新加坡",
          "type": "COUNTRY",
          "aliases": [],
          "description": "疑似攻击者IP所在国家",
          "mention_text": "新加坡",
          "evidence_text": "初次和C2服务器交互实现发送指令的疑似攻击者IP地址是一个新加坡的IP地址",
          "char_start": 3004,
          "char_end": 3041,
          "confidence": 0.9,
          "candidate_status": "candidate",
          "validation_status": "valid",
          "validation_errors": []
        },
        {
          "name": "hsne••••••••••16@gmail.com",
          "type": "FINANCIAL_ACCOUNT",
          "aliases": [],
          "description": "攻击者使用的邮箱地址",
          "mention_text": "hsne••••••••••16@gmail[.]com",
          "evidence_text": "挖掘到了一个攻击者使用的邮箱地址：hsne••••••••••16@gmail[.]com",
          "char_start": 3051,
          "char_end": 3096,
          "confidence": 0.9,
          "candidate_status": "candidate",
          "validation_status": "valid",
          "validation_errors": []
        },
        {
          "name": "new••••••••••@mail.ru",
          "type": "FINANCIAL_ACCOUNT",
          "aliases": [],
          "description": "绑定的gmail邮箱地址",
          "mention_text": "new••••••••••@mail.ru",
          "evidence_text": "绑定gmail的邮箱地址为：new••••••••••@mail.ru",
          "char_start": 3099,
          "char_end": 3134,
          "confidence": 0.9,
          "candidate_status": "candidate",
          "validation_status": "valid",
          "validation_errors": []
        },
        {
          "name": "ipipipip.net",
          "type": "TOOL",
          "aliases": [],
          "description": "攻击者使用的IP查询网站",
          "mention_text": "ipipipip.net",
          "evidence_text": "攻击者使用的搜索引擎是朝鲜语的ipipipip.net",
          "char_start": 3254,
          "char_end": 3281,
          "confidence": 0.9,
          "candidate_status": "candidate",
          "validation_status": "valid",
          "validation_errors": []
        },
        {
          "name": "downmaner15@rambler.ru",
          "type": "FINANCIAL_ACCOUNT",
          "aliases": [],
          "description": "注册域名的邮箱",
          "mention_text": "downmaner15@rambler.ru",
          "evidence_text": "注册域名的邮箱均为后缀为.ru的邮箱地址",
          "char_start": 3524,
          "char_end": 3544,
          "confidence": 0.9,
          "candidate_status": "candidate",
          "validation_status": "valid",
          "validation_errors": []
        },
        {
          "name": "bit.ly",
          "type": "INFRASTRUCTURE",
          "aliases": [],
          "description": "短链接服务",
          "mention_text": "bit.ly",
          "evidence_text": "hxxp://bit[.]ly/2CZnAqD",
          "char_start": 471,
          "char_end": 494,
          "confidence": 0.9,
          "candidate_status": "candidate",
          "validation_status": "valid",
          "validation_errors": []
        },
        {
          "name": "oaass-torrent.com",
          "type": "INFRASTRUCTURE",
          "aliases": [],
          "description": "恶意APK下载域名",
          "mention_text": "oaass-torrent.com",
          "evidence_text": "hxxp://oaass-torrent[.]com/KakaoTalk.APK",
          "char_start": 496,
          "char_end": 536,
          "confidence": 0.9,
          "candidate_status": "candidate",
          "validation_status": "valid",
          "validation_errors": []
        },
        {
          "name": "download-apks.com",
          "type": "INFRASTRUCTURE",
          "aliases": [],
          "description": "钓鱼页面域名",
          "mention_text": "download-apks.com",
          "evidence_text": "hxxp://download-apks[.]com/KaokaoTalk/",
          "char_start": 624,
          "char_end": 662,
          "confidence": 0.9,
          "candidate_status": "candidate",
          "validation_status": "valid",
          "validation_errors": []
        }
      ],
      "relations": [
        {
          "head_name": "2.56.151.8",
          "head_type": "INFRASTRUCTURE",
          "relation_type": "LOCATED_IN",
          "tail_name": "日本",
          "tail_type": "COUNTRY",
          "evidence_text": "控制该电脑的IP地址为一个日本的IP地址",
          "char_start": 2906,
          "char_end": 2926,
          "confidence": 0.9,
          "candidate_status": "candidate",
          "validation_status": "valid",
          "validation_errors": []
        }
      ]
    }
  ]
}