{
  "schema_version": "1.0",
  "run_id": "extract-apt28_005-deepseek-v4-flash-1.0-1.0-20260715163418277720-5bd6e541",
  "doc_id": "apt28_005",
  "model_name": "deepseek-v4-flash",
  "prompt_version": "1.0",
  "generated_at": "2026-07-15T16:34:18.277720+00:00",
  "chunks": [
    {
      "chunk_id": "apt28_005_c001",
      "entities": [
        {
          "name": "Microsoft",
          "type": "ORGANIZATION",
          "aliases": [],
          "description": "美国科技公司，提起诉讼要求控制虚假网站",
          "mention_text": "微软",
          "evidence_text": "微软向美国法院提起诉讼",
          "char_start": 3,
          "char_end": 14,
          "confidence": 0.9,
          "candidate_status": "candidate",
          "validation_status": "valid",
          "validation_errors": []
        },
        {
          "name": "Strontium",
          "type": "APT_GROUP",
          "aliases": [
            "Fancy Bear",
            "APT28"
          ],
          "description": "与俄罗斯军事机构GRU有关的黑客组织",
          "mention_text": "Strontium",
          "evidence_text": "这些虚假网站均由Strontium集团创建，该集团与俄罗斯军事机构GRU有关，别名Fancy Bear或APT28",
          "char_start": 52,
          "char_end": 109,
          "confidence": 0.9,
          "candidate_status": "candidate",
          "validation_status": "valid",
          "validation_errors": []
        },
        {
          "name": "GRU",
          "type": "ORGANIZATION",
          "aliases": [],
          "description": "俄罗斯军事机构",
          "mention_text": "GRU",
          "evidence_text": "该集团与俄罗斯军事机构GRU有关",
          "char_start": 74,
          "char_end": 90,
          "confidence": 0.9,
          "candidate_status": "candidate",
          "validation_status": "valid",
          "validation_errors": []
        },
        {
          "name": "Brad Smith",
          "type": "PERSON",
          "aliases": [],
          "description": "微软总裁",
          "mention_text": "布拉德·史密斯",
          "evidence_text": "微软总裁布拉德·史密斯发布声明",
          "char_start": 231,
          "char_end": 246,
          "confidence": 0.9,
          "candidate_status": "candidate",
          "validation_status": "valid",
          "validation_errors": []
        },
        {
          "name": "Hudson Institute",
          "type": "ORGANIZATION",
          "aliases": [],
          "description": "美国保守组织",
          "mention_text": "Hudson Institute",
          "evidence_text": "其中两个虚假网站模仿了美国保守组织Hudson Institute及International Republican Institute",
          "char_start": 299,
          "char_end": 367,
          "confidence": 0.9,
          "candidate_status": "candidate",
          "validation_status": "valid",
          "validation_errors": []
        },
        {
          "name": "International Republican Institute",
          "type": "ORGANIZATION",
          "aliases": [],
          "description": "美国保守组织",
          "mention_text": "International Republican Institute",
          "evidence_text": "其中两个虚假网站模仿了美国保守组织Hudson Institute及International Republican Institute",
          "char_start": 299,
          "char_end": 367,
          "confidence": 0.9,
          "candidate_status": "candidate",
          "validation_status": "valid",
          "validation_errors": []
        },
        {
          "name": "United States Senate",
          "type": "ORGANIZATION",
          "aliases": [],
          "description": "美国参议院",
          "mention_text": "美国参议院",
          "evidence_text": "Strontium创建了至少六个与美国参议院和保守组织相关的虚假网站",
          "char_start": 247,
          "char_end": 281,
          "confidence": 0.9,
          "candidate_status": "candidate",
          "validation_status": "valid",
          "validation_errors": []
        },
        {
          "name": "Microsoft AccountGuard",
          "type": "TOOL",
          "aliases": [],
          "description": "微软推出的新安全服务",
          "mention_text": "Microsoft AccountGuard",
          "evidence_text": "微软还推出了新安全服务Microsoft AccountGuard",
          "char_start": 423,
          "char_end": 456,
          "confidence": 0.9,
          "candidate_status": "candidate",
          "validation_status": "valid",
          "validation_errors": []
        },
        {
          "name": "Office365",
          "type": "TOOL",
          "aliases": [],
          "description": "微软办公软件套件",
          "mention_text": "Office365",
          "evidence_text": "可免费提供给所有使用Office365的美国联邦、州、地方候选人",
          "char_start": 457,
          "char_end": 489,
          "confidence": 0.9,
          "candidate_status": "candidate",
          "validation_status": "valid",
          "validation_errors": []
        },
        {
          "name": "Russia",
          "type": "COUNTRY",
          "aliases": [],
          "description": "俄罗斯",
          "mention_text": "俄罗斯",
          "evidence_text": "俄罗斯发言人佩斯科夫表示",
          "char_start": 619,
          "char_end": 631,
          "confidence": 0.9,
          "candidate_status": "candidate",
          "validation_status": "valid",
          "validation_errors": []
        },
        {
          "name": "Dmitry Peskov",
          "type": "PERSON",
          "aliases": [],
          "description": "俄罗斯发言人",
          "mention_text": "佩斯科夫",
          "evidence_text": "俄罗斯发言人佩斯科夫表示",
          "char_start": 619,
          "char_end": 631,
          "confidence": 0.9,
          "candidate_status": "candidate",
          "validation_status": "valid",
          "validation_errors": []
        },
        {
          "name": "2018 US midterm elections",
          "type": "EVENT",
          "aliases": [],
          "description": "美国中期选举",
          "mention_text": "美国中期选举",
          "evidence_text": "微软向美国法院提起诉讼，要求控制数个试图干涉美国中期选举的虚假网站",
          "char_start": 3,
          "char_end": 36,
          "confidence": 0.9,
          "candidate_status": "candidate",
          "validation_status": "valid",
          "validation_errors": []
        },
        {
          "name": "2016 US presidential election",
          "type": "EVENT",
          "aliases": [],
          "description": "2016年美国大选",
          "mention_text": "2016年美国大选",
          "evidence_text": "美国有政客呼吁应努力避免2016年美国大选期间发生的网络攻击事件再次出现",
          "char_start": 142,
          "char_end": 178,
          "confidence": 0.9,
          "candidate_status": "candidate",
          "validation_status": "valid",
          "validation_errors": []
        }
      ],
      "relations": [
        {
          "head_name": "Strontium",
          "head_type": "APT_GROUP",
          "relation_type": "ATTRIBUTED_TO",
          "tail_name": "GRU",
          "tail_type": "ORGANIZATION",
          "evidence_text": "该集团与俄罗斯军事机构GRU有关",
          "char_start": 74,
          "char_end": 90,
          "confidence": 0.9,
          "candidate_status": "candidate",
          "validation_status": "valid",
          "validation_errors": []
        },
        {
          "head_name": "Strontium",
          "head_type": "APT_GROUP",
          "relation_type": "TARGETS",
          "tail_name": "United States Senate",
          "tail_type": "ORGANIZATION",
          "evidence_text": "Strontium创建了至少六个与美国参议院和保守组织相关的虚假网站",
          "char_start": 247,
          "char_end": 281,
          "confidence": 0.9,
          "candidate_status": "candidate",
          "validation_status": "valid",
          "validation_errors": []
        },
        {
          "head_name": "Strontium",
          "head_type": "APT_GROUP",
          "relation_type": "TARGETS",
          "tail_name": "Hudson Institute",
          "tail_type": "ORGANIZATION",
          "evidence_text": "其中两个虚假网站模仿了美国保守组织Hudson Institute及International Republican Institute",
          "char_start": 299,
          "char_end": 367,
          "confidence": 0.9,
          "candidate_status": "candidate",
          "validation_status": "valid",
          "validation_errors": []
        },
        {
          "head_name": "Strontium",
          "head_type": "APT_GROUP",
          "relation_type": "TARGETS",
          "tail_name": "International Republican Institute",
          "tail_type": "ORGANIZATION",
          "evidence_text": "其中两个虚假网站模仿了美国保守组织Hudson Institute及International Republican Institute",
          "char_start": 299,
          "char_end": 367,
          "confidence": 0.9,
          "candidate_status": "candidate",
          "validation_status": "valid",
          "validation_errors": []
        },
        {
          "head_name": "Microsoft AccountGuard",
          "head_type": "TOOL",
          "relation_type": "DISCOVERED_BY",
          "tail_name": "Microsoft",
          "tail_type": "ORGANIZATION",
          "evidence_text": "微软还推出了新安全服务Microsoft AccountGuard",
          "char_start": 423,
          "char_end": 456,
          "confidence": 0.9,
          "candidate_status": "candidate",
          "validation_status": "valid",
          "validation_errors": []
        }
      ]
    }
  ]
}